ID,Book Title,Price,Availability,Rating
399,Playing with Fire,13.71,In stock,3
400,Off the Hook (Fishing for Trouble #1),47.67,In stock,3
401,Mothering Sunday,13.34,In stock,2
402,"Mother, Can You Not?",16.89,In stock,5
403,M Train,27.18,In stock,1
404,Lilac Girls,17.28,In stock,2
405,Lies and Other Acts of Love,45.14,In stock,1
406,Lab Girl,40.85,In stock,1
407,Keep Me Posted,20.46,In stock,4
408,It Didn't Start with You: How Inherited Family Trauma Shapes Who We Are and How to End the Cycle,56.27,In stock,3
409,Grey (Fifty Shades #4),48.49,In stock,4
410,"Exit, Pursued by a Bear",51.34,In stock,4
411,Daredevils,16.34,In stock,3
412,Cravings: Recipes for What You Want to Eat,20.50,In stock,3
413,Born for This: How to Find the Work You Were Meant to Do,21.59,In stock,5
414,Arena,21.36,In stock,4
415,Adultery,20.88,In stock,5
416,A Mother's Reckoning: Living in the Aftermath of Tragedy,19.53,In stock,3
417,A Gentleman's Position (Society of Gentlemen #3),14.75,In stock,5
418,11/22/63,48.48,In stock,3
419,"10% Happier: How I Tamed the Voice in My Head, Reduced Stress Without Losing My Edge, and Found Self-Help That Actually Works",24.57,In stock,2
420,10-Day Green Smoothie Cleanse: Lose Up to 15 Pounds in 10 Days!,49.71,In stock,5
421,Without Shame,48.27,In stock,5
422,Watchmen,58.05,In stock,4
423,Unlimited Intuition Now,58.87,In stock,4
424,Underlying Notes,11.82,In stock,2
425,The Shack,28.03,In stock,1
426,The New Brand You: Your New Image Makes the Sale for You,44.05,In stock,5
427,"The Moosewood Cookbook: Recipes from Moosewood Restaurant, Ithaca, New York",12.34,In stock,4
428,The Flowers Lied,16.68,In stock,2
429,"The Fabric of the Cosmos: Space, Time, and the Texture of Reality",55.91,In stock,1
430,The Book of Mormon,24.57,In stock,3
431,The Art and Science of Low Carbohydrate Living,52.98,In stock,5
432,The Alien Club,54.40,In stock,1
433,Suzie Snowflake: One beautiful flake (a self-esteem story),54.81,In stock,5
434,Nap-a-Roo,25.08,In stock,1
435,"NaNo What Now? Finding your editing process, revising your NaNoWriMo book and building a writing career through publishing and beyond",10.41,In stock,4
436,Modern Day Fables,47.44,In stock,2
437,If I Gave You God's Phone Number....: Searching for Spirituality in America,20.91,In stock,1
438,"Fruits Basket, Vol. 9 (Fruits Basket #9)",33.95,In stock,4
439,Dress Your Family in Corduroy and Denim,43.68,In stock,3
440,Don't Forget Steven,33.23,In stock,1
441,Chernobyl 01:23:40: The Incredible True Story of the World's Worst Nuclear Disaster,35.92,In stock,2
442,Art and Fear: Observations on the Perils (and Rewards) of Artmaking,48.63,In stock,4
443,A Shard of Ice (The Black Symphony Saga #1),56.63,In stock,3
444,A Hero's Curse (The Unseen Chronicles #1),50.49,In stock,3
445,23 Degrees South: A Tropical Tale of Changing Whether...,35.79,In stock,2
446,"Zero to One: Notes on Startups, or How to Build the Future",34.06,In stock,3
447,Why Not Me?,17.76,In stock,1
448,When Breath Becomes Air,39.36,In stock,2
449,Vagabonding: An Uncommon Guide to the Art of Long-Term World Travel,36.94,In stock,2
450,The Unlikely Pilgrimage of Harold Fry (Harold Fry #1),43.62,In stock,5
451,The New Drawing on the Right Side of the Brain,43.02,In stock,3
452,"The Midnight Assassin: Panic, Scandal, and the Hunt for America's First Serial Killer",28.45,In stock,4
453,The Martian (The Martian #1),41.39,In stock,2
454,The High Mountains of Portugal,51.15,In stock,1
455,The Grownup,35.88,In stock,1
456,The E-Myth Revisited: Why Most Small Businesses Don't Work and What to Do About It,36.91,In stock,1
457,South of Sunshine,28.93,In stock,1
458,Smarter Faster Better: The Secrets of Being Productive in Life and Business,38.89,In stock,5
459,Silence in the Dark (Logan Point #4),58.33,In stock,3
460,Shadows of the Past (Logan Point #1),39.67,In stock,5
461,Roller Girl,14.10,In stock,5
462,Rising Strong,21.82,In stock,3
463,Proofs of God: Classical Arguments from Tertullian to Barth,54.21,In stock,1
464,Please Kill Me: The Uncensored Oral History of Punk,31.19,In stock,4
465,Out of Print: City Lights Spotlight No. 14,53.64,In stock,5
466,My Life Next Door (My Life Next Door ),36.39,In stock,5
467,Miller's Valley,58.54,In stock,2
468,Man's Search for Meaning,29.48,In stock,3
469,"Love That Boy: What Two Presidents, Eight Road Trips, and My Son Taught Me About a Parent's Expectations",25.06,In stock,2
470,Living Forward: A Proven Plan to Stop Drifting and Get the Life You Want,12.55,In stock,3
471,Les Fleurs du Mal,29.04,In stock,5
472,Left Behind (Left Behind #1),40.72,In stock,2
473,Kill 'Em and Leave: Searching for James Brown and the American Soul,45.05,In stock,5
474,Kierkegaard: A Christian Missionary to Christians,47.13,In stock,1
475,John Vassos: Industrial Design for Modern Life,20.22,In stock,4
476,I'll Give You the Sun,56.48,In stock,1
477,I Will Find You,44.21,In stock,1
478,Hystopia: A Novel,21.96,In stock,4
479,Howl and Other Poems,40.45,In stock,2
480,History of Beauty,10.29,In stock,4
481,Heaven is for Real: A Little Boy's Astounding Story of His Trip to Heaven and Back,52.86,In stock,2
482,Future Shock (Future Shock #1),55.65,In stock,5
483,Ender's Game (The Ender Quintet #1),43.64,In stock,1
484,Diary of a Citizen Scientist: Chasing Tiger Beetles and Other New Ways of Engaging the World,28.41,In stock,1
485,Death by Leisure: A Cautionary Tale,37.51,In stock,4
486,Brilliant Beacons: A History of the American Lighthouse,11.45,In stock,3
487,Brazen: The Courage to Find the You That's Been Hiding,19.22,In stock,2
488,Between the World and Me,56.91,In stock,4
489,Being Mortal: Medicine and What Matters in the End,55.06,In stock,4
490,"A Murder Over a Girl: Justice, Gender, Junior High",13.20,In stock,3
491,32 Yolks,53.63,In stock,2
492,"""Most Blessed of the Patriarchs"": Thomas Jefferson and the Empire of the Imagination",44.48,In stock,5
493,You Are a Badass: How to Stop Doubting Your Greatness and Start Living an Awesome Life,12.08,In stock,3
494,Wildlife of New York: A Five-Borough Coloring Book,22.14,In stock,2
495,What Happened on Beale Street (Secrets of the South Mysteries #2),25.37,In stock,5
496,Unreasonable Hope: Finding Faith in the God Who Brings Purpose to Your Pain,46.33,In stock,2
497,Under the Tuscan Sun,37.33,In stock,3
498,Toddlers Are A**holes: It's Not Your Fault,25.55,In stock,1
499,The Year of Living Biblically: One Man's Humble Quest to Follow the Bible as Literally as Possible,34.72,In stock,1
500,The Whale,35.96,In stock,4
501,The Story of Art,41.14,In stock,4
502,The Origin of Species,10.01,In stock,4
503,The Great Gatsby,36.05,In stock,4
504,The Good Girl,49.03,In stock,3
505,The Glass Castle,16.24,In stock,1
506,The Faith of Christopher Hitchens: The Restless Soul of the World's Most Notorious Atheist,39.55,In stock,1
507,The Drowning Girls,35.67,In stock,3
508,The Constant Princess (The Tudor Court #1),16.62,In stock,3
509,The Bourne Identity (Jason Bourne #1),42.78,In stock,4
510,The Bachelor Girl's Guide to Murder (Herringford and Watts Mysteries #1),52.30,In stock,5
511,The Art Book,32.34,In stock,2
512,The 7 Habits of Highly Effective People: Powerful Lessons in Personal Change,33.17,In stock,4
513,Team of Rivals: The Political Genius of Abraham Lincoln,20.12,In stock,5
514,Steal Like an Artist: 10 Things Nobody Told You About Being Creative,20.90,In stock,2
515,"Sit, Stay, Love",20.90,In stock,3
516,Sister Dear,40.20,In stock,4
517,"Shrunken Treasures: Literary Classics, Short, Sweet, and Silly",52.87,In stock,3
518,"Rich Dad, Poor Dad",51.74,In stock,1
519,Raymie Nightingale,34.41,In stock,2
520,Playing from the Heart,32.38,In stock,1
521,Nightstruck: A Novel,50.35,In stock,4
522,"Naturally Lean: 125 Nourishing Gluten-Free, Plant-Based Recipes--All Under 300 Calories",11.38,In stock,5
523,Meternity,43.58,In stock,3
524,Memoirs of a Geisha,49.67,In stock,3
525,Like Never Before (Walker Family #2),28.77,In stock,2
526,Life of Pi,13.22,In stock,4
527,Leave This Song Behind: Teen Poetry at Its Best,51.17,In stock,5
528,King's Folly (The Kinsman Chronicles #1),39.61,In stock,5
529,John Adams,57.43,In stock,4
530,How to Cook Everything Vegetarian: Simple Meatless Recipes for Great Food (How to Cook Everything),46.01,In stock,4
531,How to Be a Domestic Goddess: Baking and the Art of Comfort Cooking,28.25,In stock,2
532,Good in Bed (Cannie Shapiro #1),37.05,In stock,5
533,"Fruits Basket, Vol. 7 (Fruits Basket #7)",19.57,In stock,1
534,For the Love: Fighting for Grace in a World of Impossible Standards,45.13,In stock,3
535,Finding God in the Ruins: How God Redeems Pain,46.64,In stock,2
536,Every Heart a Doorway (Every Heart A Doorway #1),12.16,In stock,5
537,Delivering the Truth (Quaker Midwife Mystery #1),20.89,In stock,4
538,Counted With the Stars (Out from Egypt #1),17.97,In stock,5
539,"Chronicles, Vol. 1",52.60,In stock,2
540,Blue Like Jazz: Nonreligious Thoughts on Christian Spirituality,25.77,In stock,1
541,Benjamin Franklin: An American Life,48.19,In stock,3
542,"At The Existentialist Café: Freedom, Being, and apricot cocktails with: Jean-Paul Sartre, Simone de Beauvoir, Albert Camus, Martin Heidegger, Edmund Husserl, Karl Jaspers, Maurice Merleau-Ponty and others",29.93,In stock,5
543,A Summer In Europe,44.34,In stock,2
544,A Short History of Nearly Everything,52.40,In stock,5
545,A Gathering of Shadows (Shades of Magic #2),44.81,In stock,4
546,The Sound Of Love,57.84,In stock,5
547,The Rise and Fall of the Third Reich: A History of Nazi Germany,39.67,In stock,2
548,The Perks of Being a Wallflower,55.02,In stock,3
549,The Mysterious Affair at Styles (Hercule Poirot #1),24.80,In stock,4
550,The Man Who Mistook His Wife for a Hat and Other Clinical Tales,59.45,In stock,4
551,The Makings of a Fatherless Child,31.58,In stock,2
552,The Joy of Cooking,43.27,In stock,4
553,The Invention of Wings,37.34,In stock,1
554,The Hobbit (Middle-Earth Universe),17.80,In stock,5
555,The Great Railway Bazaar,30.54,In stock,1
556,The Golden Compass (His Dark Materials #1),18.77,In stock,1
557,The God Delusion,46.85,In stock,3
558,The Girl You Left Behind (The Girl You Left Behind #1),15.79,In stock,1
559,The Fellowship of the Ring (The Lord of the Rings #1),10.27,In stock,2
560,The Collected Poems of W.B. Yeats (The Collected Works of W.B. Yeats #1),15.42,In stock,5
561,The Barefoot Contessa Cookbook,59.92,In stock,5
562,Tell the Wolves I'm Home,50.96,In stock,2
563,Ship Leaves Harbor: Essays on Travel by a Recovering Journeyman,30.60,In stock,3
564,Pride and Prejudice,19.27,In stock,4
565,Musicophilia: Tales of Music and the Brain,46.58,In stock,1
566,Mere Christianity,48.51,In stock,3
567,Me Before You (Me Before You #1),19.02,In stock,1
568,In the Woods (Dublin Murder Squad #1),38.38,In stock,2
569,In Cold Blood,49.98,In stock,4
570,How to Stop Worrying and Start Living,46.49,In stock,5
571,Give It Back,18.32,In stock,2
572,"Girl, Interrupted",42.14,In stock,3
573,Fun Home: A Family Tragicomic,56.59,In stock,4
574,"Fruits Basket, Vol. 6 (Fruits Basket #6)",20.96,In stock,4
575,Deception Point,40.32,In stock,4
576,"Death Note, Vol. 6: Give-and-Take (Death Note #6)",36.39,In stock,3
577,Catherine the Great: Portrait of a Woman,58.55,In stock,4
578,Better Homes and Gardens New Cook Book,39.61,In stock,3
579,An Unquiet Mind: A Memoir of Moods and Madness,21.30,In stock,3
580,A Year in Provence (Provence #1),56.88,In stock,4
581,World Without End (The Pillars of the Earth #2),32.97,In stock,4
582,"Will Grayson, Will Grayson (Will Grayson, Will Grayson)",47.31,In stock,4
583,Why Save the Bankers?: And Other Essays on Our Economic and Political Crisis,48.67,In stock,2
584,Where She Went (If I Stay #2),41.73,In stock,4
585,What If?: Serious Scientific Answers to Absurd Hypothetical Questions,53.68,In stock,4
586,Two Summers,14.64,In stock,1
587,This Is Your Brain on Music: The Science of a Human Obsession,38.40,In stock,1
588,The Secret Garden,15.08,In stock,4
589,The Raven King (The Raven Cycle #4),30.57,In stock,2
590,The Raven Boys (The Raven Cycle #1),57.74,In stock,4
591,The Power Greens Cookbook: 140 Delicious Superfood Recipes,11.05,In stock,5
592,The Metamorphosis,28.58,In stock,1
593,The Mathews Men: Seven Brothers and the War Against Hitler's U-boats,42.91,In stock,5
594,The Little Paris Bookshop,24.73,In stock,3
595,The Hiding Place,55.91,In stock,4
596,The Grand Design,13.76,In stock,3
597,The Firm,45.56,In stock,3
598,The Fault in Our Stars,47.22,In stock,1
599,The False Prince (The Ascendance Trilogy #1),56.00,In stock,5
600,The Expatriates,44.58,In stock,2
601,The Dream Thieves (The Raven Cycle #2),34.50,In stock,1
602,The Darkest Corners,11.33,In stock,5
603,The Crossover,38.77,In stock,4
604,The 5th Wave (The 5th Wave #1),11.83,In stock,2
605,Tell the Wind and Fire,45.51,In stock,3
606,Tell Me Three Things,41.81,In stock,1
607,Talking to Girls About Duran Duran: One Young Man's Quest for True Love and a Cooler Haircut,25.15,In stock,4
608,Siddhartha,34.22,In stock,5
609,Shiver (The Wolves of Mercy Falls #1),16.23,In stock,5
610,Remember Me?,11.48,In stock,3
611,Red Dragon (Hannibal Lecter #1),23.37,In stock,3
612,Peak: Secrets from the New Science of Expertise,16.28,In stock,2
613,My Mother Was Nuts,31.63,In stock,4
614,Mexican Today: New and Rediscovered Recipes for Contemporary Kitchens,24.91,In stock,5
615,Maybe Something Beautiful: How Art Transformed a Neighborhood,22.54,In stock,1
616,Lola and the Boy Next Door (Anna and the French Kiss #2),23.63,In stock,4
617,Logan Kade (Fallen Crest High #5.5),13.12,In stock,2
618,Last One Home (New Beginnings #1),59.98,In stock,3
619,Killing Floor (Jack Reacher #1),31.49,In stock,4
620,Kill the Boy Band,15.52,In stock,5
621,Isla and the Happily Ever After (Anna and the French Kiss #3),48.13,In stock,5
622,If I Stay (If I Stay #1),38.13,In stock,5
623,I Know Why the Caged Bird Sings (Maya Angelou's Autobiography #1),36.55,In stock,2
624,Harry Potter and the Deathly Hallows (Harry Potter #7),23.32,In stock,1
625,"Fruits Basket, Vol. 5 (Fruits Basket #5)",16.33,In stock,1
626,Foundation (Foundation (Publication Order) #1),32.42,In stock,1
627,Fool Me Once,16.96,In stock,1
628,Find Her (Detective D.D. Warren #8),22.37,In stock,1
629,Evicted: Poverty and Profit in the American City,42.27,In stock,1
630,Drama,38.70,In stock,2
631,Dracula the Un-Dead,35.63,In stock,5
632,Digital Fortress,58.00,In stock,5
633,"Death Note, Vol. 5: Whiteout (Death Note #5)",52.41,In stock,1
634,"Data, A Love Story: How I Gamed Online Dating to Meet My Match",32.35,In stock,3
635,Critique of Pure Reason,20.75,In stock,1
636,Booked,17.49,In stock,5
637,"Blue Lily, Lily Blue (The Raven Cycle #3)",34.13,In stock,5
638,Approval Junkie: Adventures in Caring Too Much,58.81,In stock,5
639,An Abundance of Katherines,10.00,In stock,5
640,America's War for the Greater Middle East: A Military History,51.22,In stock,2
641,Alight (The Generations Trilogy #2),58.59,In stock,4
642,A Girl's Guide to Moving On (New Beginnings #2),31.30,In stock,1
643,A Game of Thrones (A Song of Ice and Fire #1),46.42,In stock,2
644,A Feast for Crows (A Song of Ice and Fire #4),17.21,In stock,4
645,A Clash of Kings (A Song of Ice and Fire #2),10.79,In stock,3
646,Vogue Colors A to Z: A Fashion Coloring Book,52.35,In stock,4
647,The Shining (The Shining #1),27.88,In stock,3
648,The Pilgrim's Progress,50.26,In stock,2
649,The Perfect Play (Play by Play #1),59.99,In stock,3
650,The Passion of Dolssa,28.32,In stock,5
651,The Jazz of Physics: The Secret Link Between Music and the Structure of the Universe,38.71,In stock,3
652,The Hunger Games (The Hunger Games #1),29.85,In stock,5
653,The Hound of the Baskervilles (Sherlock Holmes #5),14.82,In stock,2
654,The Gunning of America: Business and the Making of American Gun Culture,16.81,In stock,4
655,The Geography of Bliss: One Grump's Search for the Happiest Places in the World,28.23,In stock,2
656,The Demonists (Demonist #1),52.11,In stock,2
657,"The Demon Prince of Momochi House, Vol. 4 (The Demon Prince of Momochi House #4)",27.88,In stock,2
658,The Bone Hunters (Lexy Vaughan & Steven Macaulay #2),59.71,In stock,3
659,The Beast (Black Dagger Brotherhood #14),46.08,In stock,5
660,Some Women,13.73,In stock,5
661,Shopaholic Ties the Knot (Shopaholic #3),48.39,In stock,5
662,Paper and Fire (The Great Library #2),49.45,In stock,5
663,Outlander (Outlander #1),19.67,In stock,5
664,"Orchestra of Exiles: The Story of Bronislaw Huberman, the Israel Philharmonic, and the One Thousand Jews He Saved from Nazi Horrors",12.36,In stock,3
665,No One Here Gets Out Alive,20.02,In stock,5
666,Night Shift (Night Shift #1-20),12.75,In stock,4
667,Needful Things,47.51,In stock,4
668,Mockingjay (The Hunger Games #3),20.44,In stock,4
669,Misery,34.79,In stock,2
670,Little Women (Little Women #1),28.07,In stock,4
671,It,25.01,In stock,3
672,Harry Potter and the Sorcerer's Stone (Harry Potter #1),13.90,In stock,3
673,Harry Potter and the Prisoner of Azkaban (Harry Potter #3),24.17,In stock,4
674,Harry Potter and the Order of the Phoenix (Harry Potter #5),31.63,In stock,4
675,Harry Potter and the Half-Blood Prince (Harry Potter #6),48.75,In stock,5
676,Harry Potter and the Chamber of Secrets (Harry Potter #2),14.74,In stock,1
677,Gone with the Wind,32.49,In stock,3
678,God Is Not Great: How Religion Poisons Everything,27.80,In stock,1
679,Girl With a Pearl Earring,26.77,In stock,1
680,"Fruits Basket, Vol. 4 (Fruits Basket #4)",50.44,In stock,4
681,Far From True (Promise Falls Trilogy #2),34.93,In stock,2
682,Dark Lover (Black Dagger Brotherhood #1),12.87,In stock,1
683,Confessions of a Shopaholic (Shopaholic #1),48.94,In stock,2
684,Changing the Game (Play by Play #2),13.38,In stock,3
685,Candide,58.63,In stock,3
686,Can You Keep a Secret?,21.94,In stock,1
687,Atlas Shrugged,26.58,In stock,5
688,Animal Farm,57.22,In stock,3
689,A Walk to Remember,56.43,In stock,1
690,A New Earth: Awakening to Your Life's Purpose,55.65,In stock,5
691,"A History of God: The 4,000-Year Quest of Judaism, Christianity, and Islam",27.62,In stock,1
692,'Salem's Lot,49.56,In stock,4
693,Zero History (Blue Ant #3),34.77,In stock,1
694,Wuthering Heights,17.73,In stock,3
695,World War Z: An Oral History of the Zombie War,21.80,In stock,1
696,Wild: From Lost to Found on the Pacific Crest Trail,46.02,In stock,3
697,"Where'd You Go, Bernadette",18.13,In stock,1
698,When You Are Engulfed in Flames,30.89,In stock,5
699,We the People: The Modern-Day Figures Who Have Reshaped and Affirmed the Founding Fathers' Vision of America,31.95,In stock,3
700,We Are All Completely Beside Ourselves,24.04,In stock,1
701,Walk the Edge (Thunder Road #2),32.36,In stock,3
702,Voyager (Outlander #3),21.07,In stock,5
703,Very Good Lives: The Fringe Benefits of Failure and the Importance of Imagination,50.66,In stock,3
704,Vegan Vegetarian Omnivore: Dinner for Everyone at the Table,13.66,In stock,2
705,"Unstuffed: Decluttering Your Home, Mind, and Soul",58.09,In stock,1
706,Under the Banner of Heaven: A Story of Violent Faith,30.00,In stock,1
707,Two Boys Kissing,32.74,In stock,2
708,Twilight (Twilight #1),41.93,In stock,2
709,Twenties Girl,42.80,In stock,2
710,"Trespassing Across America: One Man's Epic, Never-Done-Before (and Sort of Illegal) Hike Across the Heartland",53.51,In stock,1
711,Three-Martini Lunch,23.21,In stock,3
712,"Thinking, Fast and Slow",21.14,In stock,1
713,The Wild Robot,56.07,In stock,3
714,"The Wicked + The Divine, Vol. 3: Commercial Suicide (The Wicked + The Divine)",14.41,In stock,3
715,The Undomestic Goddess,45.75,In stock,4
716,The Travelers,15.77,In stock,1
717,The Tipping Point: How Little Things Can Make a Big Difference,10.02,In stock,2
718,The Thing About Jellyfish,48.77,In stock,1
719,The Stand,57.86,In stock,2
720,The Smitten Kitchen Cookbook,23.59,In stock,1
721,The Silkworm (Cormoran Strike #2),23.05,In stock,5
722,"The Sandman, Vol. 3: Dream Country (The Sandman (volumes) #3)",55.55,In stock,5
723,The Rose & the Dagger (The Wrath and the Dawn #2),58.64,In stock,4
724,The Road to Little Dribbling: Adventures of an American in Britain (Notes From a Small Island #2),23.21,In stock,1
725,The Rise of Theodore Roosevelt (Theodore Roosevelt #1),42.57,In stock,3
726,The Restaurant at the End of the Universe (Hitchhiker's Guide to the Galaxy #2),10.92,In stock,1
727,The Rest Is Noise: Listening to the Twentieth Century,34.77,In stock,1
728,The Red Tent,35.66,In stock,5
729,The Purpose Driven Life: What on Earth Am I Here for?,37.19,In stock,3
730,The Purest Hook (Second Circle Tattoos #3),12.25,In stock,1
731,The Picture of Dorian Gray,29.70,In stock,2
732,The Paris Wife,36.80,In stock,3
733,The Obsession,45.43,In stock,1
734,The Nightingale,26.26,In stock,4
735,The New Guy (and Other Senior Year Distractions),44.92,In stock,3
736,The Nanny Diaries (Nanny #1),52.53,In stock,5
737,The Name of God is Mercy,37.25,In stock,2
738,The Maze Runner (The Maze Runner #1),20.93,In stock,1
739,The Lover's Dictionary,58.09,In stock,2
740,The Lonely Ones,43.59,In stock,5
741,The Lean Startup: How Today's Entrepreneurs Use Continuous Innovation to Create Radically Successful Businesses,33.92,In stock,3
742,The Last Painting of Sara de Vos,55.55,In stock,2
743,"The Land of 10,000 Madonnas",29.64,In stock,4
744,The Infinities,27.41,In stock,1
745,The Husband's Secret,52.51,In stock,5
746,The Hitchhiker's Guide to the Galaxy (Hitchhiker's Guide to the Galaxy #1),47.80,In stock,3
747,The Guns of August,14.54,In stock,2
748,The Guernsey Literary and Potato Peel Pie Society,49.53,In stock,1
749,The Goldfinch,43.58,In stock,3
750,The Giver (The Giver Quartet #1),12.30,In stock,1
751,The Girl with All the Gifts,49.47,In stock,3
752,The Girl Who Played with Fire (Millennium Trilogy #2),22.14,In stock,2
753,The Girl Who Kicked the Hornet's Nest (Millennium Trilogy #3),57.48,In stock,1
754,The Exiled,43.45,In stock,3
755,"The End of Faith: Religion, Terror, and the Future of Reason",22.13,In stock,4
756,"The Elegant Universe: Superstrings, Hidden Dimensions, and the Quest for the Ultimate Theory",13.03,In stock,4
757,"The Disappearing Spoon: And Other True Tales of Madness, Love, and the History of the World from the Periodic Table of the Elements",57.35,In stock,5
758,The Devil Wears Prada (The Devil Wears Prada #1),44.29,In stock,1
759,The Demon-Haunted World: Science as a Candle in the Dark,52.25,In stock,4
760,The Day the Crayons Came Home (Crayons),26.33,In stock,5
761,The Da Vinci Code (Robert Langdon #2),22.96,In stock,2
762,The Cuckoo's Calling (Cormoran Strike #1),19.21,In stock,1
763,The Complete Stories and Poems (The Works of Edgar Allan Poe [Cameo Edition]),26.78,In stock,4
764,The Complete Poems,41.32,In stock,5
765,The Catcher in the Rye,24.55,In stock,1
766,The Cat in the Hat (Beginner Books B-1),16.26,In stock,2
767,The Case for Christ (Cases for Christianity),47.84,In stock,1
768,The Book Thief,53.49,In stock,2
769,The Book of Basketball: The NBA According to The Sports Guy,44.84,In stock,5
770,The Blind Side: Evolution of a Game,53.71,In stock,5
771,The Autobiography of Malcolm X,23.43,In stock,2
772,"The Art of Simple Food: Notes, Lessons, and Recipes from a Delicious Revolution",34.32,In stock,3
773,The Art of Fielding,22.10,In stock,1
774,"Surely You're Joking, Mr. Feynman!: Adventures of a Curious Character",25.83,In stock,2
775,Stiff: The Curious Lives of Human Cadavers,36.74,In stock,3
776,Spilled Milk: Based on a True Story,49.51,In stock,1
777,Something Borrowed (Darcy & Rachel #1),48.96,In stock,5
778,Something Blue (Darcy & Rachel #2),54.62,In stock,1
779,Soldier (Talon #3),24.72,In stock,2
780,Shopaholic & Baby (Shopaholic #5),46.45,In stock,2
781,Seven Days in the Art World,52.33,In stock,2
782,Seven Brief Lessons on Physics,30.60,In stock,4
783,Scarlet (The Lunar Chronicles #2),14.57,In stock,4
784,Sarah's Key,46.29,In stock,1
785,"Saga, Volume 3 (Saga (Collected Editions) #3)",21.57,In stock,5
786,Running with Scissors,12.91,In stock,4
787,Rogue Lawyer (Rogue Lawyer #1),50.11,In stock,3
788,"Rise of the Rocket Girls: The Women Who Propelled Us, from Missiles to the Moon to Mars",41.67,In stock,4
789,Rework,44.88,In stock,2
790,Reservations for Two,11.10,In stock,3
791,Red: The True Story of Red Riding Hood,28.54,In stock,3
792,Ready Player One,19.07,In stock,4
793,Quiet: The Power of Introverts in a World That Can't Stop Talking,43.55,In stock,1
794,Prodigy: The Graphic Novel (Legend: The Graphic Novel #2),43.63,In stock,3
795,Persepolis: The Story of a Childhood (Persepolis #1-2),39.13,In stock,1
796,Packing for Mars: The Curious Science of Life in the Void,56.68,In stock,2
797,Outliers: The Story of Success,14.16,In stock,1
798,Original Fake,31.45,In stock,3
799,Orange Is the New Black,24.61,In stock,2
800,One for the Money (Stephanie Plum #1),32.87,In stock,2
801,Notes from a Small Island (Notes From a Small Island #1),40.17,In stock,1
802,Night (The Night Trilogy #1),13.51,In stock,1
803,Neither Here nor There: Travels in Europe,38.95,In stock,3
804,Naked,31.69,In stock,3
805,Morning Star (Red Rising #3),29.40,In stock,1
806,"Miracles from Heaven: A Little Girl, Her Journey to Heaven, and Her Amazing Story of Healing",57.83,In stock,1
807,Midnight Riot (Peter Grant/ Rivers of London - books #1),55.46,In stock,2
808,Me Talk Pretty One Day,57.60,In stock,2
809,Manuscript Found in Accra,34.98,In stock,2
810,Lust & Wonder,11.87,In stock,2
811,Lila (Gilead #3),12.47,In stock,3
812,"Life, the Universe and Everything (Hitchhiker's Guide to the Galaxy #3)",33.26,In stock,2
813,Life Without a Recipe,59.04,In stock,5
814,Life After Life,26.13,In stock,2
